{
  "$schema": "https://json-schema.org/draft/2020-12/schema",
  "$id": "https://santho090.github.io/inference-capacity-contract/schemas/model-manifest-1.0.schema.json",
  "title": "Pinned Model Manifest 1.0",
  "type": "object",
  "required": ["schema_version", "model", "artifact_bytes", "tensor_element_count", "field_sources", "evidence"],
  "properties": {
    "schema_version": {"const": "model-manifest-1.0"},
    "model": {"$ref": "https://santho090.github.io/inference-capacity-contract/schemas/capacity-contract-2.0.schema.json#/$defs/model"},
    "artifact_bytes": {"type": "integer", "minimum": 1},
    "tensor_element_count": {"type": ["integer", "null"], "minimum": 1},
    "field_sources": {
      "type": "object",
      "minProperties": 1,
      "additionalProperties": {"type": "string", "minLength": 1}
    },
    "evidence": {
      "type": "array",
      "minItems": 1,
      "items": {"$ref": "https://santho090.github.io/inference-capacity-contract/schemas/capacity-contract-2.0.schema.json#/$defs/evidence"}
    }
  },
  "additionalProperties": false
}
