{
  "schema_version": "model-manifest-1.0",
  "model": {
    "model_id": "example/long-context-moe",
    "revision": "aaaaaaaaaaaaaaaaaaaaaaaaaaaaaaaaaaaaaaaa",
    "parameter_count": 240000000000,
    "num_layers": 64,
    "num_kv_heads": 8,
    "head_dim": 128,
    "weight_dtype": "bf16",
    "max_model_len": 1048576,
    "explicit_weight_bytes": null,
    "attention_type": "mla",
    "kv_bytes_per_token_per_device_override": 4096,
    "architecture": "ExampleLongContextMoEForCausalLM"
  },
  "artifact_bytes": 515396075520,
  "tensor_element_count": null,
  "field_sources": {
    "model_id": "caller.repo_id",
    "revision": "caller.immutable_revision",
    "parameter_count": "config.num_parameters",
    "num_layers": "config.num_hidden_layers",
    "num_kv_heads": "config.num_key_value_heads",
    "head_dim": "derived:config.hidden_size/config.num_attention_heads",
    "weight_dtype": "config.torch_dtype",
    "max_model_len": "config.max_position_embeddings",
    "attention_type": "derived:config-attention-fields",
    "artifact_bytes": "safetensors-index.metadata.total_size",
    "kv_bytes_per_token_per_device_override": "caller.measured-runtime-override"
  },
  "evidence": [
    {
      "evidence_id": "hf-manifest-aaaaaaaaaaaaaaaaaaaaaaaaaaaaaaaaaaaaaaaa",
      "kind": "reported",
      "source": "hf://example/long-context-moe@aaaaaaaaaaaaaaaaaaaaaaaaaaaaaaaaaaaaaaaa",
      "scope": "config.json and SafeTensors index metadata",
      "metrics": {
        "artifact_bytes": 515396075520,
        "revision": "aaaaaaaaaaaaaaaaaaaaaaaaaaaaaaaaaaaaaaaa"
      },
      "collected_at": null
    }
  ]
}
